{
  "schemaVersion": "1.0.0",
  "agentId": "security-privacy-auditor",
  "filesystemRead": true,
  "filesystemWrite": false,
  "networkAccess": false,
  "mcpAccess": false,
  "shellAccess": false,
  "gitWrite": false,
  "remoteWrite": false,
  "productionWrite": false,
  "sheetsWrite": false,
  "appsScriptWrite": false,
  "brokerApiWrite": false,
  "deploy": false,
  "merge": false,
  "push": false,
  "secretsAccess": "MASKED_EVIDENCE_ONLY",
  "allowedTools": ["repository.read", "repository.search"],
  "deniedTools": ["network", "mcp", "shell", "filesystem.write", "git.write", "remote.write", "production.write", "sheets.write", "apps-script.write", "broker-api.write", "deploy", "merge", "push", "secrets.modify", "agent.install", "agent.remove", "package.install"],
  "enforcementLayer": ["NON_DISCOVERY_STAGING_BOUNDARY", "PROFILE_SANDBOX_READ_ONLY", "IOS_APPEND_ONLY_OVERLAY"],
  "contractStatus": "LOCALLY_VALIDATED",
  "evidenceStatus": "RUNTIME_ENFORCEMENT_UNVERIFIED"
}
